{"id":"t","title":"T","sections":[{"id":"s","questions":["q1"]}],"questions":[{"id":"q1","kind":"single","prompt":"P q1","choices":[{"id":"a","text":"A"},{"id":"b","text":"B"},{"id":"c","text":"C"}],"answer":"a"},{"id":"q2","kind":"single","prompt":"P q2","choices":[{"id":"a","text":"A"},{"id":"b","text":"B"},{"id":"c","text":"C"}],"answer":"a"},{"id":"q3","kind":"single","prompt":"P q3","choices":[{"id":"a","text":"A"},{"id":"b","text":"B"},{"id":"c","text":"C"}],"answer":"a"},{"id":"q4","kind":"single","prompt":"P q4","choices":[{"id":"a","text":"A"},{"id":"b","text":"B"},{"id":"c","text":"C"}],"answer":"a"},{"id":"q5","kind":"single","prompt":"P q5","choices":[{"id":"a","text":"A"},{"id":"b","text":"B"},{"id":"c","text":"C"}],"answer":"a"},{"id":"q6","kind":"single","prompt":"P q6","choices":[{"id":"a","text":"A"},{"id":"b","text":"B"},{"id":"c","text":"C"}],"answer":"a"},{"id":"q7","kind":"single","prompt":"P q7","choices":[{"id":"a","text":"A"},{"id":"b","text":"B"},{"id":"c","text":"C"}],"answer":"a"},{"id":"q8","kind":"single","prompt":"P q8","choices":[{"id":"a","text":"A"},{"id":"b","text":"B"},{"id":"c","text":"C"}],"answer":"a"},{"id":"q9","kind":"single","prompt":"P q9","choices":[{"id":"a","text":"A"},{"id":"b","text":"B"},{"id":"c","text":"C"}],"answer":"a"},{"id":"q10","kind":"single","prompt":"P q10","choices":[{"id":"a","text":"A"},{"id":"b","text":"B"},{"id":"c","text":"C"}],"answer":"a"},{"id":"q11","kind":"single","prompt":"P q11","choices":[{"id":"a","text":"A"},{"id":"b","text":"B"},{"id":"c","text":"C"}],"answer":"a"}]}